[
  {
    "description": "invalid",
    "data": {
      "a": 1,
      "b": 2
    },
    "valid": false,
    "errors": [
      {
        "instanceLocation": "",
        "code": "unknownProperty",
        "params": {
          "property": "a"
        }
      },
      {
        "instanceLocation": "",
        "code": "unknownProperty",
        "params": {
          "property": "b"
        }
      }
    ]
  }
]
