[
  {
    "description": "under the maximum",
    "data": {
      "max": "abc"
    },
    "valid": true,
    "errors": []
  },
  {
    "description": "under the minimum",
    "data": {
      "min": "abc"
    },
    "valid": false,
    "errors": [
      {
        "instanceLocation": "/min",
        "code": "minLength",
        "params": {
          "limit": 1e+20,
          "actual": 3
        }
      }
    ]
  }
]
